{
  "schema": "aalie.content.module",
  "schemaVersion": "1.0.0",
  "spaceId": "user-guide",
  "moduleId": "mod-user-guide-loop-invariant",
  "slug": "invariante-de-bucle",
  "title": "Razonamiento con invariante de bucle",
  "shortTitle": "Invariante",
  "order": 6,
  "locale": "es",
  "version": "1.0.0",
  "status": "published",
  "summary": "Qué es un invariante en palabras sencillas y cómo usar una sugerencia del analizador sin confundirla con una demostración de examen.",
  "difficulty": "advanced",
  "estimatedMinutes": 42,
  "tags": ["invariante", "correctitud", "analizador"],
  "searchMeta": {
    "aliases": ["loop invariant", "invariante"],
    "keywords": ["while", "for"]
  },
  "prerequisites": {
    "modules": [{ "id": "mod-user-guide-interpreting", "kind": "recommended" }],
    "sections": []
  },
  "relatedModuleIds": ["mod-user-guide-interpreting", "mod-user-guide-analysis-limits"],
  "learningObjectives": [
    {
      "objectiveId": "obj-invariante-def",
      "text": "Enunciar un invariante en prosa clara y contrastarlo con la sugerencia de la aplicación si existe."
    }
  ],
  "terms": [
    {
      "termId": "term-correctitud",
      "label": "correctitud",
      "aliases": [],
      "definition": "Propiedad de que el algoritmo hace lo que debe respecto a la especificación (por ejemplo devuelve la suma correcta). Se estudia aparte del costo."
    },
    {
      "termId": "term-invariante",
      "label": "invariante de bucle",
      "aliases": ["invariante"],
      "definition": "Afirmación que permanece verdadera cada vez que se va a comprobar la condición del bucle; ayuda a explicar por qué al terminar el algoritmo se cumple la meta."
    }
  ],
  "resources": {
    "images": [
      {
        "resourceId": "img-ug-m6-invariant-hint",
        "kind": "figure",
        "source": { "kind": "backendAsset", "assetId": "ug-capture-invariant-suggestion-es" },
        "alt": "Captura pendiente: panel o tooltip con sugerencia de invariante.",
        "caption": "Pantalla a capturar: sugerencia de invariante junto a un WHILE o FOR en el analizador (si la función existe en tu versión)."
      }
    ]
  },
  "chapters": [
    {
      "chapterId": "cap-inv",
      "slug": "invariante-como-apoyo",
      "title": "Invariante como apoyo en la interfaz",
      "order": 1,
      "summary": "Definiciones y uso pedagógico de la herramienta.",
      "sections": [
        {
          "sectionId": "sec-que-es-invariante",
          "slug": "definicion-y-uso",
          "title": "Qué es un invariante (y qué no resuelve la app)",
          "order": 1,
          "kind": "theory",
          "trackProgress": true,
          "estimatedMinutes": 22,
          "blocks": [
            {
              "id": "blk-m6-s1-p1",
              "type": "paragraph",
              "content": [
                {
                  "type": "text",
                  "text": "En clase de "
                },
                {
                  "type": "term",
                  "termRef": "term-correctitud",
                  "text": "correctitud",
                  "display": "highlight"
                },
                {
                  "type": "text",
                  "text": " se demuestra que el programa cumple su especificación. Un "
                },
                {
                  "type": "term",
                  "termRef": "term-invariante",
                  "text": "invariante de bucle",
                  "display": "highlight"
                },
                {
                  "type": "text",
                  "text": " es una frase que se mantiene verdadera al inicio de cada vuelta del bucle (justo antes de volver a evaluar la guarda). Sirve para convencer de que, al salir del bucle, la variable de salida tiene el valor correcto. Eso es independiente de cuánto "
                },
                {
                  "type": "strong",
                  "text": "cuesta"
                },
                {
                  "type": "text",
                  "text": " en tiempo: puedes tener un bucle correcto pero lento."
                }
              ]
            },
            {
              "id": "blk-m6-s1-algo",
              "type": "algorithm",
              "language": "pseudocode",
              "title": "Ejemplo: suma 1..n con WHILE",
              "code": "sumar_hasta(n) BEGIN\n  s <- 0;\n  i <- 1;\n  WHILE i <= n DO BEGIN\n    s <- s + i;\n    i <- i + 1;\n  END\n  RETURN s;\nEND",
              "caption": "Invariante típico al entrar al WHILE: s es la suma de los números de 1 hasta i−1. Cuando i supera n, s es la suma de 1..n."
            },
            {
              "id": "blk-m6-s1-fig",
              "type": "figure",
              "resourceRef": "img-ug-m6-invariant-hint"
            },
            {
              "id": "blk-m6-s1-tool",
              "type": "paragraph",
              "content": [
                {
                  "type": "text",
                  "text": "Pasos en el "
                },
                {
                  "type": "link",
                  "text": "analizador",
                  "target": { "kind": "external", "ref": "/analyzer" }
                },
                {
                  "type": "text",
                  "text": ": introduce un programa con bucle, ejecuta el análisis y busca una caja o sugerencia de invariante. Léela en voz alta: ¿es una frase que podrías defender por escrito en una entrega? Si no, reescríbela con tus palabras antes de usarla."
                }
              ]
            },
            {
              "id": "blk-m6-s1-ev",
              "type": "evidenceBlock",
              "variant": "concept",
              "icon": "school",
              "title": "Límites de la sugerencia automática",
              "blocks": [
                {
                  "id": "blk-m6-s1-ev-p",
                  "type": "paragraph",
                  "content": [
                    {
                      "type": "text",
                      "text": "La aplicación puede proponer un borrador de "
                    },
                    {
                      "type": "term",
                      "termRef": "term-invariante",
                      "text": "invariante",
                      "display": "highlight"
                    },
                    {
                      "type": "text",
                      "text": ": es punto de partida, no nota de examen. Comprueba casos límite (n = 0, n = 1) y pregúntate si el invariante implica realmente la "
                    },
                    {
                      "type": "term",
                      "termRef": "term-correctitud",
                      "text": "correctitud",
                      "display": "highlight"
                    },
                    {
                      "type": "text",
                      "text": " del resultado."
                    }
                  ]
                }
              ]
            }
          ]
        },
        {
          "sectionId": "sec-no-prueba",
          "slug": "no-es-prueba-formal",
          "title": "Qué entregar en clase frente a qué muestra la pantalla",
          "order": 2,
          "kind": "theory",
          "trackProgress": true,
          "estimatedMinutes": 14,
          "blocks": [
            {
              "id": "blk-m6-s2-p1",
              "type": "paragraph",
              "content": [
                {
                  "type": "text",
                  "text": "La "
                },
                {
                  "type": "term",
                  "termRef": "term-correctitud",
                  "text": "correctitud",
                  "display": "highlight"
                },
                {
                  "type": "text",
                  "text": " formal y la "
                },
                {
                  "type": "strong",
                  "text": "complejidad"
                },
                {
                  "type": "text",
                  "text": " responden preguntas distintas. Un "
                },
                {
                  "type": "term",
                  "termRef": "term-invariante",
                  "text": "invariante",
                  "display": "highlight"
                },
                {
                  "type": "text",
                  "text": " mal redactado puede ser falso aunque el programa pase pruebas sueltas. La herramienta no reemplaza al docente: úsala como apoyo para formular y revisar tu propia demostración."
                }
              ]
            },
            {
              "id": "blk-m6-s2-ex",
              "type": "paragraph",
              "content": [
                {
                  "type": "text",
                  "text": "Ejemplo: decir «al final el arreglo está ordenado» puede cumplirse por casualidad en un vector de prueba. Un invariante útil relaciona cada paso con la meta (por ejemplo qué parte del vector ya está ordenada y qué insertas en cada vuelta)."
                }
              ]
            }
          ]
        }
      ]
    }
  ]
}
